<?xml version="1.0" encoding="utf-8"?>
<!DOCTYPE Products SYSTEM "file:///C:/XMLFinal/ECommerce/ECommerceAPI/ECommerceAPI/XmlData/Products.dtd"[]>
<!--"file:///C:/XMLFinal/ECommerce/ECommerceAPI/ECommerceAPI/XmlData/Products.dtd"-->
<Products>
  <Product>
    <Id>1</Id>
    <Name>Akıllı Telefon X</Name>
    <Description>Gelişmiş özelliklere sahip en son akıllı telefon modeli. 5G destekli ve yüksek çözünürlüklü kamera.</Description>
    <Price>999.99</Price>
    <CategoryId>3</CategoryId>
    <ImageUrl>/images/smartphone-x.jpg</ImageUrl>
    <StockQuantity>50</StockQuantity>
    <Discount>0.10</Discount>
    <Tag>Telefon</Tag>
    <Tag>5G</Tag>
    <Tag>Akıllı</Tag>
  </Product>
  <Product>
    <Id>2</Id>
    <Name>Dizüstü Bilgisayar Pro</Name>
    <Description>Profesyoneller için yüksek performanslı dizüstü bilgisayar. 16GB RAM ve 1TB SSD depolama alanı.</Description>
    <Price>1499.99</Price>
    <CategoryId>2</CategoryId>
    <ImageUrl>/images/laptop-pro.jpg</ImageUrl>
    <StockQuantity>30</StockQuantity>
    <Tag>Bilgisayar</Tag>
    <Tag>Yüksek Performans</Tag>
  </Product>
  <Product>
    <Id>3</Id>
    <Name>Kablosuz Kulaklık Plus</Name>
    <Description>Gürültü önleyici özelliğe sahip, su geçirmez kablosuz kulaklık. 24 saat pil ömrü.</Description>
    <Price>199.95</Price>
    <CategoryId>3</CategoryId>
    <ImageUrl>/images/wireless-headphones.jpg</ImageUrl>
    <StockQuantity>75</StockQuantity>
    <Discount>0.15</Discount>
    <Tag>Kulaklık</Tag>
    <Tag>Kablosuz</Tag>
    <Tag>Gürültü Önleyici</Tag>
  </Product>
  <Product>
    <Id>4</Id>
    <Name>4K Smart TV</Name>
    <Description>55 inç 4K Ultra HD çözünürlüklü akıllı televizyon. HDR desteği ve dahili uygulamalar.</Description>
    <Price>649.99</Price>
    <CategoryId>1</CategoryId>
    <ImageUrl>/images/smart-tv.jpg</ImageUrl>
    <StockQuantity>15</StockQuantity>
    <Tag>TV</Tag>
    <Tag>4K</Tag>
    <Tag>Smart</Tag>
  </Product>
  <Product>
    <Id>5</Id>
    <Name>Akıllı Saat Pro</Name>
    <Description>Sağlık takibi, GPS ve bildirim özellikleriyle tam donanımlı akıllı saat. Su geçirmez tasarım.</Description>
    <Price>299.50</Price>
    <CategoryId>3</CategoryId>
    <ImageUrl>/images/smartwatch.jpg</ImageUrl>
    <StockQuantity>40</StockQuantity>
    <Tag>Saat</Tag>
    <Tag>Fitness</Tag>
    <Tag>Akıllı</Tag>
  </Product>
  <Product>
    <Id>6</Id>
    <Name>Oyun Konsolu Elite</Name>
    <Description>En son teknoloji ile donatılmış yüksek performanslı oyun konsolu. 1TB depolama ve 4K oyun desteği.</Description>
    <Price>499.99</Price>
    <CategoryId>4</CategoryId>
    <ImageUrl>/images/game-console.jpg</ImageUrl>
    <StockQuantity>25</StockQuantity>
    <Discount>0.05</Discount>
    <Tag>Oyun</Tag>
    <Tag>Konsol</Tag>
    <Tag>4K</Tag>
  </Product>
  <Product>
    <Id>7</Id>
    <Name>Akıllı Ev Asistanı</Name>
    <Description>Sesli komutlarla kontrol edilebilen akıllı ev asistanı. Müzik çalma, hava durumu ve akıllı ev cihazları kontrolü.</Description>
    <Price>89.95</Price>
    <CategoryId>5</CategoryId>
    <ImageUrl>/images/home-assistant.jpg</ImageUrl>
    <StockQuantity>60</StockQuantity>
    <Tag>Akıllı Ev</Tag>
    <Tag>Sesli Asistan</Tag>
  </Product>
  <Product>
    <Id>8</Id>
    <Name>Elektrikli Scooter</Name>
    <Description>30km menzilli, katlanabilir elektrikli scooter. Şehir içi ulaşım için ideal.</Description>
    <Price>399.99</Price>
    <CategoryId>6</CategoryId>
    <ImageUrl>/images/e-scooter.jpg</ImageUrl>
    <StockQuantity>20</StockQuantity>
    <Discount>0.08</Discount>
    <Tag>Ulaşım</Tag>
    <Tag>Elektrikli</Tag>
    <Tag>Çevre Dostu</Tag>
  </Product>
  <Product>
    <Id>9</Id>
    <Name>Drone Kamera</Name>
    <Description>4K video kaydedebilen, katlanabilir drone. 25 dakika uçuş süresi ve otomatik takip özellikleri.</Description>
    <Price>599.99</Price>
    <CategoryId>7</CategoryId>
    <ImageUrl>/images/drone.jpg</ImageUrl>
    <StockQuantity>12</StockQuantity>
    <Tag>Drone</Tag>
    <Tag>Kamera</Tag>
    <Tag>4K</Tag>
  </Product>
  <Product>
    <Id>10</Id>
    <Name>Profesyonel Fotoğraf Makinesi</Name>
    <Description>24.2MP sensör, 4K video kayıt ve değiştirilebilir lens uyumlu profesyonel fotoğraf makinesi.</Description>
    <Price>899.95</Price>
    <CategoryId>7</CategoryId>
    <ImageUrl>/images/camera.jpg</ImageUrl>
    <StockQuantity>18</StockQuantity>
    <Discount>0.12</Discount>
    <Tag>Fotoğraf</Tag>
    <Tag>Profesyonel</Tag>
    <Tag>DSLR</Tag>
  </Product>
  <Product>
    <Id>11</Id>
    <Name>Bluetooth Hoparlör Max</Name>
    <Description>Su geçirmez, 20 saat pil ömrüne sahip taşınabilir bluetooth hoparlör. Derin bas ve net ses kalitesi.</Description>
    <Price>129.99</Price>
    <CategoryId>3</CategoryId>
    <ImageUrl>/images/bluetooth-speaker.jpg</ImageUrl>
    <StockQuantity>45</StockQuantity>
    <Discount>0.07</Discount>
    <Tag>Ses</Tag>
    <Tag>Bluetooth</Tag>
    <Tag>Su Geçirmez</Tag>
  </Product>
  <Product>
    <Id>12</Id>
    <Name>Akıllı Robot Süpürge</Name>
    <Description>Lazer navigasyon teknolojili, programlanabilir akıllı robot süpürge. Mobil uygulama ile uzaktan kontrol.</Description>
    <Price>349.95</Price>
    <CategoryId>5</CategoryId>
    <ImageUrl>/images/robot-vacuum.jpg</ImageUrl>
    <StockQuantity>22</StockQuantity>
    <Tag>Ev Aletleri</Tag>
    <Tag>Robot</Tag>
    <Tag>Temizlik</Tag>
  </Product>
  <Product>
    <Id>13</Id>
    <Name>Taşınabilir SSD Disk</Name>
    <Description>1TB kapasiteli, yüksek hızlı USB 3.1 taşınabilir SSD disk. Kompakt tasarım ve şok direnci.</Description>
    <Price>179.50</Price>
    <CategoryId>2</CategoryId>
    <ImageUrl>/images/portable-ssd.jpg</ImageUrl>
    <StockQuantity>55</StockQuantity>
    <Discount>0.10</Discount>
    <Tag>Depolama</Tag>
    <Tag>SSD</Tag>
    <Tag>Taşınabilir</Tag>
  </Product>
  <Product>
    <Id>14</Id>
    <Name>Oyuncu Klavyesi RGB</Name>
    <Description>Mekanik tuşlara ve özelleştirilebilir RGB aydınlatmaya sahip profesyonel oyuncu klavyesi.</Description>
    <Price>149.99</Price>
    <CategoryId>4</CategoryId>
    <ImageUrl>/images/gaming-keyboard.jpg</ImageUrl>
    <StockQuantity>38</StockQuantity>
    <Tag>Oyun</Tag>
    <Tag>Klavye</Tag>
    <Tag>RGB</Tag>
  </Product>
  <Product>
    <Id>15</Id>
    <Name>Kablosuz Şarj Standı</Name>
    <Description>15W hızlı şarj destekli, çift cihaz şarj edebilen kablosuz şarj standı. Telefon ve akıllı saat uyumlu.</Description>
    <Price>59.95</Price>
    <CategoryId>3</CategoryId>
    <ImageUrl>/images/wireless-charger.jpg</ImageUrl>
    <StockQuantity>70</StockQuantity>
    <Discount>0.15</Discount>
    <Tag>Şarj</Tag>
    <Tag>Kablosuz</Tag>
    <Tag>Aksesuvar</Tag>
  </Product>
  <Product>
    <Id>16</Id>
    <Name>Akıllı Tartı Pro</Name>
    <Description>Vücut yağ oranı, kas kütlesi ve diğer 12 ölçüm parametresi sunabilen akıllı tartı. Mobil uygulama bağlantısı.</Description>
    <Price>79.95</Price>
    <CategoryId>5</CategoryId>
    <ImageUrl>/images/smart-scale.jpg</ImageUrl>
    <StockQuantity>42</StockQuantity>
    <Tag>Sağlık</Tag>
    <Tag>Akıllı Ev</Tag>
    <Tag>Fitness</Tag>
  </Product>
  <Product>
    <Id>17</Id>
    <Name>Grafik Tablet Pro</Name>
    <Description>8192 basınç seviyeli, 10 inç çizim alanına sahip profesyonel grafik tableti. Kalem dahil.</Description>
    <Price>249.99</Price>
    <CategoryId>2</CategoryId>
    <ImageUrl>/images/graphic-tablet.jpg</ImageUrl>
    <StockQuantity>25</StockQuantity>
    <Tag>Çizim</Tag>
    <Tag>Tasarım</Tag>
    <Tag>Dijital</Tag>
  </Product>
  <Product>
    <Id>18</Id>
    <Name>Oyun Koltuğu Ergonomik</Name>
    <Description>Bel ve boyun desteği olan, yüksek kaliteli PU deri kaplı ergonomik oyuncu koltuğu. 150kg taşıma kapasitesi.</Description>
    <Price>279.95</Price>
    <CategoryId>4</CategoryId>
    <ImageUrl>/images/gaming-chair.jpg</ImageUrl>
    <StockQuantity>15</StockQuantity>
    <Discount>0.08</Discount>
    <Tag>Mobilya</Tag>
    <Tag>Oyun</Tag>
    <Tag>Ergonomik</Tag>
  </Product>
  <Product>
    <Id>19</Id>
    <Name>Akıllı Ampul Set</Name>
    <Description>16 milyon renk seçeneği sunan, sesli asistan uyumlu akıllı ampul seti. 4 adet bulb içerir.</Description>
    <Price>89.99</Price>
    <CategoryId>5</CategoryId>
    <ImageUrl>/images/smart-bulbs.jpg</ImageUrl>
    <StockQuantity>60</StockQuantity>
    <Tag>Aydınlatma</Tag>
    <Tag>Akıllı Ev</Tag>
    <Tag>LED</Tag>
  </Product>
  <Product>
    <Id>20</Id>
    <Name>360 Derece Aksiyon Kamerası</Name>
    <Description>Su geçirmez, 5.7K video kaydı yapabilen 360 derece aksiyon kamerası. Gelişmiş görüntü sabitleme.</Description>
    <Price>329.95</Price>
    <CategoryId>7</CategoryId>
    <ImageUrl>/images/360-camera.jpg</ImageUrl>
    <StockQuantity>18</StockQuantity>
    <Discount>0.10</Discount>
    <Tag>Kamera</Tag>
    <Tag>360</Tag>
    <Tag>Aksiyon</Tag>
  </Product>
  <Product>
    <Id>21</Id>
    <Name>Ultrabook İnce Laptop</Name>
    <Description>14 inç, 1.2kg hafifliğinde, 12 saat pil ömrüne sahip ultra ince dizüstü bilgisayar. i7 işlemci ve 512GB SSD.</Description>
    <Price>1299.99</Price>
    <CategoryId>2</CategoryId>
    <ImageUrl>/images/ultrabook.jpg</ImageUrl>
    <StockQuantity>20</StockQuantity>
    <Tag>Laptop</Tag>
    <Tag>Ultrabook</Tag>
    <Tag>İnce</Tag>
  </Product>
  <Product>
    <Id>22</Id>
    <Name>Akıllı Termostat</Name>
    <Description>Enerji tasarrufu sağlayan, akıllı telefon kontrollü programlanabilir termostat. Sesli asistan uyumlu.</Description>
    <Price>119.95</Price>
    <CategoryId>5</CategoryId>
    <ImageUrl>/images/smart-thermostat.jpg</ImageUrl>
    <StockQuantity>30</StockQuantity>
    <Discount>0.05</Discount>
    <Tag>Akıllı Ev</Tag>
    <Tag>Enerji</Tag>
    <Tag>İklimlendirme</Tag>
  </Product>
  <Product>
    <Id>23</Id>
    <Name>Fitness Bilekliği</Name>
    <Description>Nabız, uyku ve aktivite takibi yapan, 7 gün pil ömürlü su geçirmez akıllı bileklik.</Description>
    <Price>79.95</Price>
    <CategoryId>3</CategoryId>